#"Welcome To Employee Payroll Services MySQL"

#UC1 Ability to create a payroll service database

mysql> create database payroll_services;
Query OK, 1 row affected (0.07 sec)

mysql> use payroll_services;
Database changed
mysql> select database();
+------------------+
| database()       |
+------------------+
| payroll_services |
+------------------+
1 row in set (0.00 sec)

mysql> #UC2 Ability to create employee payroll table

mysql>  create table employee_payroll
    -> (
    -> id INT unsigned NOT NULL AUTO_INCREMENT,
    -> name VARCHAR(150) NOT NULL,
    -> salary double NOT NULL,
    -> start DATE NOT NULL,
    -> PRIMARY KEY(id));
Query OK, 0 rows affected (0.88 sec)

mysql> describe employee_payroll;
+--------+--------------+------+-----+---------+----------------+
| Field  | Type         | Null | Key | Default | Extra          |
+--------+--------------+------+-----+---------+----------------+
| id     | int unsigned | NO   | PRI | NULL    | auto_increment |
| name   | varchar(150) | NO   |     | NULL    |                |
| salary | double       | NO   |     | NULL    |                |
| start  | date         | NO   |     | NULL    |                |
+--------+--------------+------+-----+---------+----------------+
4 rows in set (0.08 sec)
mysql> #UC3 Ability to create employee payroll data in payroll service database as part of CRUD operation
mysql>
mysql> INSERT INTO employee_payroll (name, salary, start) VALUES
    -> ('Sreedhar', 500000.00, '2023-01-01'),
    -> ('Narasappa', 2500000.00, '2023-01-05'),
    -> ('Vamshi', 3500000.00, '2023-01-10');
Query OK, 3 rows affected (0.15 sec)
Records: 3  Duplicates: 0  Warnings: 0


mysql> #UC4 Ability to retrieve all the employee payroll data that is added to payroll service database
mysql> SELECT * FROM employee_payroll;
+----+-----------+---------+------------+
| id | name      | salary  | start      |
+----+-----------+---------+------------+
|  1 | Sreedhar  |  500000 | 2023-01-01 |
|  2 | Narasappa | 2500000 | 2023-01-05 |
|  3 | Vamshi    | 3500000 | 2023-01-10 |
+----+-----------+---------+------------+
3 rows in set (0.00 sec)


mysql> SELECT salary FROM employee_payroll;
+---------+
| salary  |
+---------+
|  500000 |
| 2500000 |
| 3500000 |
+---------+
3 rows in set (0.00 sec)


mysql> #UC6 Ability to add Gender to employee payroll table and update rows to reflect the correct employee Gender
mysql> ALTER TABLE employee_payroll ADD Gender varchar(10) after name;
Query OK, 0 rows affected (0.30 sec)
Records: 0  Duplicates: 0  Warnings: 0

mysql>  update employee_payroll set gender = 'M' where name = 'Sreedhar';
Query OK, 1 row affected (0.07 sec)
Rows matched: 1  Changed: 1  Warnings: 0

mysql>  update employee_payroll set gender = 'F' where name = 'Narasappa';
Query OK, 1 row affected (0.05 sec)
Rows matched: 1  Changed: 1  Warnings: 0

mysql>  update employee_payroll set gender = 'F' where name = 'Vamshi';
Query OK, 1 row affected (0.05 sec)
Rows matched: 1  Changed: 1  Warnings: 0

mysql> SELECT * FROM employee_payroll;
+----+-----------+--------+---------+------------+
| id | name      | Gender | salary  | start      |
+----+-----------+--------+---------+------------+
|  1 | Sreedhar  | M      |  500000 | 2023-01-01 |
|  2 | Narasappa | F      | 2500000 | 2023-01-05 |
|  3 | Vamshi    | F      | 3500000 | 2023-01-10 |
+----+-----------+--------+---------+------------+
3 rows in set (0.00 sec)


mysql>  #UC7 ability to find sum, average, min, max and number of male and female emlpoyees
mysql>
mysql> update employee_payroll set salary = 400000.00 where name = 'Narasappa';
Query OK, 1 row affected (0.03 sec)
Rows matched: 1  Changed: 1  Warnings: 0

mysql> SELECT * FROM employee_payroll;
+----+-----------+--------+---------+------------+
| id | name      | Gender | salary  | start      |
+----+-----------+--------+---------+------------+
|  1 | Sreedhar  | M      |  500000 | 2023-01-01 |
|  2 | Narasappa | F      |  400000 | 2023-01-05 |
|  3 | Vamshi    | F      | 3500000 | 2023-01-10 |
+----+-----------+--------+---------+------------+
3 rows in set (0.00 sec)

mysql> SELECT SUM(salary) FROM employee_payroll
    -> WHERE gender = 'M' GROUP BY gender;
+-------------+
| SUM(salary) |
+-------------+
|      500000 |
+-------------+
1 row in set (0.05 sec)

mysql> SELECT SUM(salary) FROM employee_payroll
    -> WHERE gender = 'F' GROUP BY gender;
+-------------+
| SUM(salary) |
+-------------+
|     3900000 |
+-------------+
1 row in set (0.00 sec)

mysql>  SELECT MIN(salary) FROM employee_payroll
    -> WHERE gender = 'F' GROUP BY gender;
+-------------+
| MIN(salary) |
+-------------+
|      400000 |
+-------------+
1 row in set (0.01 sec)

mysql>  SELECT gender, AVG(salary) FROM employee_payroll GROUP BY gender;
+--------+-------------+
| gender | AVG(salary) |
+--------+-------------+
| M      |      500000 |
| F      |     1950000 |
+--------+-------------+
2 rows in set (0.02 sec)

mysql> SELECT gender, COUNT(name) FROM employee_payroll GROUP BY gender;
+--------+-------------+
| gender | COUNT(name) |
+--------+-------------+
| M      |           1 |
| F      |           2 |
+--------+-------------+
2 rows in set (0.00 sec)

 #UC8 Ability to extend employee_payroll data to store employee information like employee phone, address and department - Ensure employee department
mysql> select * from employee_payroll;
+----+-----------+--------+---------+------------+
| id | name      | Gender | salary  | start      |
+----+-----------+--------+---------+------------+
|  1 | Sreedhar  | M      |  500000 | 2023-01-01 |
|  2 | Narasappa | F      |  400000 | 2023-01-05 |
|  3 | Vamshi    | F      | 3500000 | 2023-01-10 |
+----+-----------+--------+---------+------------+
3 rows in set (0.00 sec)

mysql> alter table employee_payroll add phone_number varchar(250) after name;
Query OK, 0 rows affected (0.13 sec)
Records: 0  Duplicates: 0  Warnings: 0

mysql> select * from employee_payroll;
+----+-----------+--------------+--------+---------+------------+
| id | name      | phone_number | Gender | salary  | start      |
+----+-----------+--------------+--------+---------+------------+
|  1 | Sreedhar  | NULL         | M      |  500000 | 2023-01-01 |
|  2 | Narasappa | NULL         | F      |  400000 | 2023-01-05 |
|  3 | Vamshi    | NULL         | F      | 3500000 | 2023-01-10 |
+----+-----------+--------------+--------+---------+------------+
3 rows in set (0.00 sec)

mysql> update employee_payroll set phone_number='9652002484'where name='Sreedhar';
Query OK, 1 row affected (0.09 sec)
Rows matched: 1  Changed: 1  Warnings: 0

mysql> update employee_payroll set phone_number='9885309258'where name='Narasappa';
Query OK, 1 row affected (0.21 sec)
Rows matched: 1  Changed: 1  Warnings: 0

mysql> update employee_payroll set phone_number='8309716332'where name='Vamshi';
Query OK, 1 row affected (0.03 sec)
Rows matched: 1  Changed: 1  Warnings: 0

mysql> select * from employee_payroll;
+----+-----------+--------------+--------+---------+------------+
| id | name      | phone_number | Gender | salary  | start      |
+----+-----------+--------------+--------+---------+------------+
|  1 | Sreedhar  | 9652002484   | M      |  500000 | 2023-01-01 |
|  2 | Narasappa | 9885309258   | F      |  400000 | 2023-01-05 |
|  3 | Vamshi    | 8309716332   | F      | 3500000 | 2023-01-10 |
+----+-----------+--------------+--------+---------+------------+
3 rows in set (0.00 sec)

mysql> alter table employee_payroll add address varchar(255)not null default 'Yemmiganur, AndhraPradesh'after phone_number;
Query OK, 0 rows affected (0.12 sec)
Records: 0  Duplicates: 0  Warnings: 0

mysql> select * from employee_payroll;
+----+-----------+--------------+---------------------------+--------+---------+------------+
| id | name      | phone_number | address                   | Gender | salary  | start      |
+----+-----------+--------------+---------------------------+--------+---------+------------+
|  1 | Sreedhar  | 9652002484   | Yemmiganur, AndhraPradesh | M      |  500000 | 2023-01-01 |
|  2 | Narasappa | 9885309258   | Yemmiganur, AndhraPradesh | F      |  400000 | 2023-01-05 |
|  3 | Vamshi    | 8309716332   | Yemmiganur, AndhraPradesh | F      | 3500000 | 2023-01-10 |
+----+-----------+--------------+---------------------------+--------+---------+------------+
3 rows in set (0.00 sec)


mysql>  #UC9Ability to extend employee_payroll table to have Basic Pay, Deductions, Taxable Pay, Income Tax, Net Pay
mysql>
mysql> alter table employee_payroll drop salary;
Query OK, 0 rows affected (0.19 sec)
Records: 0  Duplicates: 0  Warnings: 0

mysql> select * from employee_payroll;
+----+-----------+--------------+---------------------------+--------+------------+
| id | name      | phone_number | address                   | Gender | start      |
+----+-----------+--------------+---------------------------+--------+------------+
|  1 | Sreedhar  | 9652002484   | Yemmiganur, AndhraPradesh | M      | 2023-01-01 |
|  2 | Narasappa | 9885309258   | Yemmiganur, AndhraPradesh | F      | 2023-01-05 |
|  3 | Vamshi    | 8309716332   | Yemmiganur, AndhraPradesh | F      | 2023-01-10 |
+----+-----------+--------------+---------------------------+--------+------------+
3 rows in set (0.00 sec)

mysql> alter table employee_payroll add basic_pay float(10) not null default '5000000'after name;
Query OK, 0 rows affected (0.09 sec)
Records: 0  Duplicates: 0  Warnings: 0

mysql> alter table employee_payroll add deductions float(10) not null default '50000'after basic_pay;
Query OK, 0 rows affected (0.12 sec)
Records: 0  Duplicates: 0  Warnings: 0

mysql> alter table employee_payroll add taxable_pay float(10) not null default '7000'after deductions;
Query OK, 0 rows affected (0.13 sec)
Records: 0  Duplicates: 0  Warnings: 0

mysql> alter table employee_payroll add income_tax float(10) not null default '15000'after taxable_pay;
Query OK, 0 rows affected (0.11 sec)
Records: 0  Duplicates: 0  Warnings: 0

mysql> alter table employee_payroll add net_pay float(10) not null default '25000'after income_tax;
Query OK, 0 rows affected (0.08 sec)
Records: 0  Duplicates: 0  Warnings: 0

mysql> select * from employee_payroll;
+----+-----------+-----------+------------+-------------+------------+---------+--------------+---------------------------+--------+------------+
| id | name      | basic_pay | deductions | taxable_pay | income_tax | net_pay | phone_number | address                   | Gender | start      |
+----+-----------+-----------+------------+-------------+------------+---------+--------------+---------------------------+--------+------------+
|  1 | Sreedhar  |   5000000 |      50000 |        7000 |      15000 |   25000 | 9652002484   | Yemmiganur, AndhraPradesh | M      | 2023-01-01 |
|  2 | Narasappa |   5000000 |      50000 |        7000 |      15000 |   25000 | 9885309258   | Yemmiganur, AndhraPradesh | F      | 2023-01-05 |
|  3 | Vamshi    |   5000000 |      50000 |        7000 |      15000 |   25000 | 8309716332   | Yemmiganur, AndhraPradesh | F      | 2023-01-10 |
+----+-----------+-----------+------------+-------------+------------+---------+--------------+---------------------------+--------+------------+
3 rows in set (0.00 sec)

mysql> #UC11 Implements the ER Diagram into payroll service DB
mysql>

mysql> create table employee_department
    ->      (
    ->      ID INT NOT NULL auto_increment,
    ->     EmpID INT unsigned,
    ->      DeptName VARCHAR(45) NOT NULL,
    ->     Primary key(ID),
    ->      FOREIGN KEY (EmpID) REFERENCES employee_payroll(id));
Query OK, 0 rows affected (0.47 sec)

mysql> insert into employee_department ( EmpId, DeptName) values (  '1', 'Finance'),
    -> ('2', 'Sales'),
    -> ('3', 'Marketing');
Query OK, 3 rows affected (0.08 sec)
Records: 3  Duplicates: 0  Warnings: 0

mysql> select * from employee_department;
+----+-------+-----------+
| ID | EmpID | DeptName  |
+----+-------+-----------+
|  1 |     1 | Finance   |
|  2 |     2 | Sales     |
|  3 |     3 | Marketing |
+----+-------+-----------+
3 rows in set (0.00 sec)

mysql> Insert into employee_department (EmpID, DeptName) values ('3','HR');
Query OK, 1 row affected (0.05 sec)

mysql> select * from employee_department;
+----+-------+-----------+
| ID | EmpID | DeptName  |
+----+-------+-----------+
|  1 |     1 | Finance   |
|  2 |     2 | Sales     |
|  3 |     3 | Marketing |
|  4 |     3 | HR        |
+----+-------+-----------+
4 rows in set (0.00 sec)

